{"actor":"synthetic-agent","event_rules":[{"authority":"trace:observe","cost_usd":0,"effect":"observe","event_type":"execution_started","id":"execution-started-v1","include_source_evidence":true,"resource":{"kind":"constant","value":"agentguard:execution"},"review":null,"status":"succeeded"},{"authority":"command:execute","cost_usd":0,"effect":"execute","event_type":"agent_command","id":"agent-command-v1","include_source_evidence":false,"resource":{"kind":"constant","value":"agentguard:command"},"review":null,"status":"derived"},{"authority":"repository:write","cost_usd":0,"effect":"write","event_type":"file_change","id":"file-change-v1","include_source_evidence":false,"resource":{"field":"path","kind":"repository_path","prefix":"repository:"},"review":null,"status":"failed"},{"authority":"test:observe","cost_usd":0,"effect":"observe","event_type":"test_result","id":"test-result-v1","include_source_evidence":true,"resource":{"kind":"constant","value":"agentguard:test"},"review":null,"status":"derived"},{"authority":"check:observe","cost_usd":0,"effect":"observe","event_type":"check_result","id":"check-result-v1","include_source_evidence":true,"resource":{"kind":"constant","value":"agentguard:check"},"review":null,"status":"derived"},{"authority":"trace:observe","cost_usd":0,"effect":"observe","event_type":"execution_completed","id":"execution-completed-v1","include_source_evidence":true,"resource":{"kind":"constant","value":"agentguard:execution"},"review":null,"status":"derived"}],"outcome_rules":[{"equals":"PASS","event_type":"execution_completed","field":"result","outcome":"task.completed"}],"schema":"agentguard.verifier-projection-policy","schema_version":1,"task":{"budget_usd":0,"max_steps":6,"required_outcomes":["task.completed"]},"verifier_policy":{"allowed_effects":["observe","write"],"authority":{"synthetic-agent":["trace:observe","test:observe","check:observe"]},"evidence_required":["execute","write"],"review_required":[]}}
